{
  "version": "0.1.0",
  "document": {
    "id": "ccc-progress-adaptation-2025",
    "title": "Progress in adapting to climate change",
    "subtitle": "2025 report to Parliament",
    "source_file": "Progress-in-adapting-to-climate-change-2025-1.pdf",
    "language": "en",
    "page_count": 170,
    "audience": "Government, Parliament and climate-resilience decision-makers",
    "purpose": "Assess whether the UK is preparing effectively for current and future climate impacts under the Third National Adaptation Programme.",
    "core_question": "Is adaptation moving from plans to effective delivery quickly enough?",
    "publisher": "Climate Change Committee"
  },
  "editorial_policy": {
    "fidelity": "restructured",
    "compression": "high",
    "notes": "Executive narrative built from the report's headline findings, assessment metrics, sector evidence and four cross-government actions. Source claims are preserved and structural compression is explicit."
  },
  "navigation": {
    "chapter_header": true,
    "reading_progress": true,
    "micro_navigation": true,
    "keyboard_navigation": true
  },
  "assets": [
    {
      "id": "ccc-hero-barrier",
      "type": "image",
      "uri": "https://images.pexels.com/photos/19623433/pexels-photo-19623433.jpeg?auto=compress&cs=tinysrgb&w=2000",
      "alt": "Thames Barrier and London skyline under an overcast sky",
      "caption": "Context image: Thames Barrier, London. Not source evidence.",
      "origin": "external",
      "credit": "Anna Rynkowska / Pexels",
      "license": "Pexels free to use",
      "license_url": "https://www.pexels.com/photo/structure-of-the-thames-river-barrier-and-modern-architecture-skyline-19623433/"
    },
    {
      "id": "ccc-land",
      "type": "image",
      "uri": "https://images.pexels.com/photos/34239427/pexels-photo-34239427.jpeg?auto=compress&cs=tinysrgb&w=2000",
      "alt": "Green fields and dry stone walls in England",
      "caption": "Context image: English rural landscape. Not source evidence.",
      "origin": "external",
      "credit": "Mike Norris / Pexels",
      "license": "Pexels free to use",
      "license_url": "https://www.pexels.com/photo/scenic-green-fields-and-stone-walls-in-england-34239427/"
    },
    {
      "id": "ccc-infrastructure",
      "type": "image",
      "uri": "https://images.pexels.com/photos/31407835/pexels-photo-31407835.jpeg?auto=compress&cs=tinysrgb&w=2000",
      "alt": "Train arriving at a London railway station",
      "caption": "Context image: London rail infrastructure. Not source evidence.",
      "origin": "external",
      "credit": "Eliezer Muller / Pexels",
      "license": "Pexels free to use",
      "license_url": "https://www.pexels.com/photo/train-arriving-at-a-busy-london-railway-station-31407835/"
    },
    {
      "id": "ccc-built",
      "type": "image",
      "uri": "https://images.pexels.com/photos/35244166/pexels-photo-35244166.jpeg?auto=compress&cs=tinysrgb&w=2000",
      "alt": "Urban flooding at Woodsmill Quay in York",
      "caption": "Context image: flooding in York. Not the evidence image used by the CCC report.",
      "origin": "external",
      "credit": "Mike Norris / Pexels",
      "license": "Pexels free to use",
      "license_url": "https://www.pexels.com/photo/historic-woodsmill-quay-flooded-in-york-35244166/"
    },
    {
      "id": "ccc-health",
      "type": "image",
      "uri": "https://images.pexels.com/photos/9703033/pexels-photo-9703033.jpeg?auto=compress&cs=tinysrgb&w=2000",
      "alt": "London Bridge Hospital illuminated at night",
      "caption": "Context image: London hospital. Not source evidence.",
      "origin": "external",
      "credit": "Jennifer Latham / Pexels",
      "license": "Pexels free to use",
      "license_url": "https://www.pexels.com/photo/illuminated-hospital-at-night-9703033/"
    },
    {
      "id": "ccc-economy",
      "type": "image",
      "uri": "https://images.pexels.com/photos/35026697/pexels-photo-35026697.jpeg?auto=compress&cs=tinysrgb&w=2000",
      "alt": "London skyline and River Thames",
      "caption": "Context image: London economy and urban system. Not source evidence.",
      "origin": "external",
      "credit": "David Allen / Pexels",
      "license": "Pexels free to use",
      "license_url": "https://www.pexels.com/photo/london-city-skyline-with-river-thames-view-35026697/"
    }
  ],
  "evidence": [
    {
      "id": "ev-core",
      "type": "conclusion",
      "status": "VERIFIED",
      "text": "The report concludes that the UK's preparations for climate change are inadequate and that effective adaptation delivery remains limited.",
      "source_refs": [
        {
          "file": "Progress-in-adapting-to-climate-change-2025-1.pdf",
          "page": 10
        }
      ]
    },
    {
      "id": "ev-wettest",
      "type": "number",
      "status": "VERIFIED",
      "text": "October 2022 to March 2024 was the wettest 18-month period on record for England.",
      "value": 18,
      "unit": "months",
      "source_refs": [
        {
          "file": "Progress-in-adapting-to-climate-change-2025-1.pdf",
          "page": 11
        }
      ]
    },
    {
      "id": "ev-40c",
      "type": "number",
      "status": "VERIFIED",
      "text": "Summer 2022 saw temperatures exceed 40°C for the first time in many places in England.",
      "value": 40,
      "unit": "°C",
      "source_refs": [
        {
          "file": "Progress-in-adapting-to-climate-change-2025-1.pdf",
          "page": 11
        }
      ]
    },
    {
      "id": "ev-deaths",
      "type": "number",
      "status": "VERIFIED",
      "text": "The 2022 heatwaves were associated with a record level of nearly 3,000 heat-related deaths recorded in England.",
      "value": 3000,
      "unit": "heat-related deaths (nearly)",
      "source_refs": [
        {
          "file": "Progress-in-adapting-to-climate-change-2025-1.pdf",
          "page": 11
        }
      ]
    },
    {
      "id": "ev-calls",
      "type": "number",
      "status": "VERIFIED",
      "text": "Fire and rescue services saw a 500% increase in 999 calls during major wildfire incidents in July 2022.",
      "value": 500,
      "unit": "% increase",
      "source_refs": [
        {
          "file": "Progress-in-adapting-to-climate-change-2025-1.pdf",
          "page": 11
        }
      ]
    },
    {
      "id": "ev-zero-good-delivery",
      "type": "number",
      "status": "VERIFIED",
      "text": "The Committee did not find evidence to score a single assessed outcome as 'good' for adaptation delivery and implementation.",
      "value": 0,
      "unit": "good delivery outcomes",
      "source_refs": [
        {
          "file": "Progress-in-adapting-to-climate-change-2025-1.pdf",
          "page": 10
        }
      ]
    },
    {
      "id": "ev-12-insufficient",
      "type": "number",
      "status": "VERIFIED",
      "text": "12 out of 46 assessed outcomes were scored as insufficient for delivery and implementation.",
      "value": 12,
      "unit": "of 46 outcomes",
      "source_refs": [
        {
          "file": "Progress-in-adapting-to-climate-change-2025-1.pdf",
          "page": 46
        }
      ]
    },
    {
      "id": "ev-three-good-plans",
      "type": "number",
      "status": "VERIFIED",
      "text": "Only three out of 46 outcomes achieved a good policies-and-plans score.",
      "value": 3,
      "unit": "of 46 outcomes",
      "source_refs": [
        {
          "file": "Progress-in-adapting-to-climate-change-2025-1.pdf",
          "page": 102
        }
      ]
    },
    {
      "id": "ev-60-plans",
      "type": "number",
      "status": "VERIFIED",
      "text": "27 outcomes, or 60%, showed limited or insufficient progress in policies and plans.",
      "value": 60,
      "unit": "%",
      "source_refs": [
        {
          "file": "Progress-in-adapting-to-climate-change-2025-1.pdf",
          "page": 102
        }
      ]
    },
    {
      "id": "ev-flood-properties",
      "type": "number",
      "status": "VERIFIED",
      "text": "6.3 million properties in England are currently in areas at risk of flooding from rivers, the sea and surface water; this could rise to around 8 million, or 25% of all properties, by 2050.",
      "source_refs": [
        {
          "file": "Progress-in-adapting-to-climate-change-2025-1.pdf",
          "page": 37
        }
      ]
    },
    {
      "id": "ev-health",
      "type": "claim",
      "status": "VERIFIED",
      "text": "Both assessed health and wellbeing delivery outcomes were scored insufficient.",
      "source_refs": [
        {
          "file": "Progress-in-adapting-to-climate-change-2025-1.pdf",
          "page": 79
        }
      ]
    },
    {
      "id": "ev-sector-areas",
      "type": "claim",
      "status": "VERIFIED",
      "text": "The assessment spans land, nature and food; infrastructure; built environment and communities; health and wellbeing; and the economy.",
      "source_refs": [
        {
          "file": "Progress-in-adapting-to-climate-change-2025-1.pdf",
          "page": 45
        }
      ]
    },
    {
      "id": "ev-four-actions",
      "type": "recommendation",
      "status": "VERIFIED",
      "text": "The report calls for four cross-government actions: improve objectives and targets; improve coordination; integrate adaptation into relevant policies; and implement monitoring, evaluation and learning across sectors.",
      "source_refs": [
        {
          "file": "Progress-in-adapting-to-climate-change-2025-1.pdf",
          "page": 10
        },
        {
          "file": "Progress-in-adapting-to-climate-change-2025-1.pdf",
          "page": 11
        }
      ]
    },
    {
      "id": "ev-turning-point",
      "type": "conclusion",
      "status": "VERIFIED",
      "text": "The report says the halfway point of NAP3 must become a turning point for a fresh approach to national climate resilience.",